{
  "$schema": "../../content-entry.schema.json",
  "collection": "challenges",
  "title": "第 1 期：两数之和",
  "slug": "challenge-two-sum",
  "publishAt": "2026-06-11",
  "dueAt": "2026-06-18",
  "tags": ["数组", "哈希表", "算法"],
  "excerpt": "给定整数数组和目标值，找出和为目标值的两个元素下标。",
  "difficulty": "easy",
  "sequence": 1,
  "cadence": "weekly",
  "isPublished": true,
  "author": "博主"
}
