{
  "$schema": "../../content-entry.schema.json",
  "collection": "challenges",
  "title": "第 2 期：实现一个防抖函数",
  "slug": "challenge-debounce",
  "publishAt": "2026-06-18",
  "dueAt": "2026-06-25",
  "tags": ["JavaScript", "函数", "工程实践"],
  "excerpt": "实现支持参数透传、this 绑定和取消调用的 debounce 函数。",
  "difficulty": "medium",
  "sequence": 2,
  "cadence": "weekly",
  "isPublished": true,
  "author": "博主"
}
