{
  "$schema": "../../content-entry.schema.json",
  "collection": "posts",
  "title": "PhyCat Markdown 主题展示",
  "slug": "phycat-theme-guide",
  "date": "2026-06-11",
  "updated": "2026-06-11",
  "category": "guides",
  "tags": ["markdown", "typora", "css", "主题"],
  "excerpt": "使用常见 Markdown 元素检查 11 套 PhyCat 主题的网页渲染效果。",
  "isTop": true,
  "isPublished": true,
  "author": "博主"
}
