{
  "$schema": "../../content-entry.schema.json",
  "collection": "posts",
  "title": "算法入门：排序算法可视化",
  "slug": "sorting-algorithm-visualization",
  "date": "2024-12-05",
  "updated": "2024-12-08",
  "category": "frontend",
  "tags": ["algorithm", "typescript"],
  "excerpt": "通过可视化方式理解常见排序算法的原理与实现。",
  "isTop": false,
  "isPublished": true,
  "author": "博主"
}
