{
  "$schema": "../../content-entry.schema.json",
  "collection": "posts",
  "title": "Node.js 微服务架构实践",
  "slug": "nodejs-microservice-practice",
  "date": "2025-03-10",
  "updated": "2025-03-12",
  "category": "backend",
  "tags": ["nodejs", "docker"],
  "excerpt": "从服务拆分、通信方式到部署运维，记录 Node.js 微服务架构的实践经验。",
  "isTop": false,
  "isPublished": true,
  "author": "博主"
}
