{
  "$schema": "../../content-entry.schema.json",
  "collection": "posts",
  "title": "博客内容管理工作流",
  "slug": "content-management-workflow",
  "date": "2026-06-10",
  "updated": "2026-06-11",
  "category": "guides",
  "tags": ["markdown", "内容管理", "工程化"],
  "excerpt": "说明文章、题目、标签和同名 JSON 元数据文件的维护方式。",
  "isTop": false,
  "isPublished": true,
  "author": "博主"
}
