{
  "$schema": "../../content-entry.schema.json",
  "collection": "posts",
  "title": "2024 年终总结",
  "slug": "2024-year-review",
  "date": "2024-12-31",
  "updated": "2025-01-01",
  "category": "life",
  "tags": ["复盘"],
  "excerpt": "回顾 2024 年的技术成长与生活点滴，展望新一年的计划。",
  "isTop": false,
  "isPublished": true,
  "author": "博主"
}
