{
  "$schema": "../../content-entry.schema.json",
  "collection": "posts",
  "title": "Git 高级技巧：从入门到精通",
  "slug": "git-advanced-tips",
  "date": "2025-01-18",
  "updated": "2025-02-10",
  "category": "tools",
  "tags": ["git"],
  "excerpt": "掌握 rebase、cherry-pick、bisect 等 Git 高级技巧。",
  "isTop": false,
  "isPublished": true,
  "author": "博主"
}
