{
  "$schema": "../../content-entry.schema.json",
  "collection": "posts",
  "title": "使用 Vue 3 + TypeScript 搭建个人博客",
  "slug": "build-blog-with-vue3-typescript",
  "date": "2025-05-15",
  "updated": "2025-05-20",
  "category": "frontend",
  "tags": ["vue", "typescript", "vite"],
  "excerpt": "使用 Vue 3 Composition API 和 TypeScript 搭建现代化个人博客。",
  "isTop": true,
  "isPublished": true,
  "author": "博主"
}
